<?xml version="1.0" encoding="UTF-8"?>
<xs:schema xmlns:xs="http://www.w3.org/2001/XMLSchema">

    <!-- Definición del elemento raíz -->
    <xs:element name="competiciones">
        <xs:complexType>
            <xs:sequence>
                <xs:element name="competicion" maxOccurs="unbounded">
                    <xs:complexType>
                        <xs:sequence>
                            <xs:element name="id_competicion" type="xs:string"/>
                            <xs:element name="nombre" type="xs:string"/>
                            <xs:element name="juego">
                                <xs:complexType>
                                    <xs:sequence>
                                        <xs:element name="id" type="xs:string"/>
                                        <xs:element name="nombre" type="xs:string"/>
                                    </xs:sequence>
                                </xs:complexType>
                            </xs:element>
                            <xs:element name="equipos">
                                <xs:complexType>
                                    <xs:sequence>
                                        <xs:element name="equipo" maxOccurs="unbounded">
                                            <xs:complexType>
                                                <xs:sequence>
                                                    <xs:element name="id" type="xs:string"/>
                                                    <xs:element name="nombre" type="xs:string"/>
                                                    <xs:element name="puntos_totales" type="xs:integer"/>
                                                </xs:sequence>
                                            </xs:complexType>
                                        </xs:element>
                                    </xs:sequence>
                                </xs:complexType>
                            </xs:element>
                            <xs:element name="fecha" type="xs:string"/>
                        </xs:sequence>
                    </xs:complexType>
                </xs:element>
            </xs:sequence>
        </xs:complexType>
    </xs:element>

    <!-- Definición de tipos individuales -->
    <xs:element name="id_competicion" type="xs:string"/>
    <xs:element name="nombre" type="xs:string"/>
    <xs:element name="fecha" type="xs:string"/>

    <xs:element name="juego">
        <xs:complexType>
            <xs:sequence>
                <xs:element name="id" type="xs:string"/>
                <xs:element name="nombre" type="xs:string"/>
            </xs:sequence>
        </xs:complexType>
    </xs:element>

    <xs:element name="equipos">
        <xs:complexType>
            <xs:sequence>
                <xs:element name="equipo" maxOccurs="unbounded">
                    <xs:complexType>
                        <xs:sequence>
                            <xs:element name="id" type="xs:string"/>
                            <xs:element name="nombre" type="xs:string"/>
                            <xs:element name="puntos_totales" type="xs:integer"/>
                        </xs:sequence>
                    </xs:complexType>
                </xs:element>
            </xs:sequence>
        </xs:complexType>
    </xs:element>

</xs:schema>
